NOAA,Find out how #Barry may affect your local weather,https://www.noaa.gov/news/get-latest-forecast-from-noaas-national-hurricane-center-ext
NOAA,Scientists uncover a centuries-old case of mistaken identity in the Chesapeake Bay,https://www.noaa.gov/news/scientists-uncover-centuries-old-case-of-mistaken-identity-in-chesapeake-bay
NOAA,U.S. Seafood Trade Task Force seeks input from industry and the public,https://www.noaa.gov/news/us-seafood-trade-task-force-seeks-input-from-industry-and-public
NOAA,2018 was 4th hottest year on record for the globe,https://www.noaa.gov/news/2018-was-4th-hottest-year-on-record-for-globe
NOAA,Globe had 3rd warmest year to date and 4th warmest October on record,https://www.noaa.gov/news/globe-had-3rd-warmest-year-to-date-and-4th-warmest-october-on-record
NOAA,June 1: Reddit Science AMA with NOAA's Dr. Gerry Bell,https://www.noaa.gov/news/june-1-reddit-science-ama-with-noaas-dr-gerry-bell
NOAA,Rare Olive Ridley sea turtle nest discovered on Hawaiian island of Oahu,https://www.noaa.gov/news/rare-olive-ridley-sea-turtle-nest-discovered-on-oahu-ext
NOAA,Hot topics in the science classroom: Extreme heat events and our nation’s estuaries,https://www.noaa.gov/office-education/data-in-classroom/news/hot-topics-in-science-classroom-extreme-heat-events-and-our-nations-estuaries
NOAA,NOAA’s Hurricane Awareness Tour,https://www.noaa.gov/news/noaa-s-hurricane-awareness-tour
NOAA,Could drying the stratosphere help cool the planet?,https://www.noaa.gov/news/could-drying-stratosphere-help-cool-planet-ext
NOAA,NOAA offices respond to container spills on both coasts,https://www.noaa.gov/news/noaa-offices-respond-to-container-spills-on-both-coasts-ext
NOAA,‘Near-average’ April was marked by deadliest tornado outbreak in 6 years,https://www.noaa.gov/news/near-average-april-was-marked-by-deadliest-tornado-outbreak-in-6-years
NOAA,NOAA and partners capture footage of what might be new species of killer whale,https://www.noaa.gov/news/noaa-and-partners-capture-footage-of-what-might-be-new-species-of-killer-whale
NOAA,New launch date targeted for NOAA weather satellite,https://www.noaa.gov/news/new-launch-date-targeted-for-noaa-weather-satellite-ext
NOAA,Increasing ocean acidity affects Alaska crabs’ shells,https://www.noaa.gov/news/increasing-ocean-acidity-affects-alaska-crabs-shells
NOAA,Scientists: Climate change poses bleaching risk to Australian coral reefs,https://www.noaa.gov/news/scientists-climate-change-poses-bleaching-risk-to-australian-coral-reefs
NOAA,Five years after Japan's tsunami: What we've learned about marine debris,https://www.noaa.gov/news/five-years-after-japans-tsunami-what-weve-learned-about-marine-debris
NOAA,March 2019 was second hottest on record for the globe,https://www.noaa.gov/news/march-2019-was-second-hottest-on-record-for-globe
NOAA,Earth had its 4th-warmest October on record,https://www.noaa.gov/news/earth-had-its-4th-warmest-october-on-record
NOAA,Former NOAA scientist honored for pioneering ocean and climate science,https://www.noaa.gov/heritage/news/former-noaa-scientist-honored-for-pioneering-ocean-and-climate-science-ext
NOAA,New podcast helps parents teach their kids about Octonauts sea creatures,https://www.noaa.gov/education/news/new-podcast-helps-parents-teach-their-kids-about-octonauts-sea-creatures
NOAA,"Argo, the 'crown jewel' of ocean observing systems, turns 25",https://www.noaa.gov/news/argo-crown-jewel-of-ocean-observing-systems-turns-25
NOAA,Stormy Fourth of July likely for parts of the Midwest and Southeast,https://www.noaa.gov/news/stormy-fourth-of-july-likely-for-parts-of-midwest-and-southeast
NOAA,Cracking the code of a long-distance swimmer,https://www.noaa.gov/news/cracking-code-of-long-distance-swimmer
NOAA,#Harvey bringing heavy rain to Ohio Valley. Latest updates,https://www.noaa.gov/news/harvey-bringing-heavy-rain-to-ohio-valley-latest-updates-ext
NOAA,April 2023 was Earth’s fourth warmest on record,https://www.noaa.gov/news/april-2023-was-earths-fourth-warmest-on-record
NOAA,U.S. warmer and drier than average in September; 3rd warmest and wettest year to date,https://www.noaa.gov/news/us-warmer-and-drier-than-average-in-september-3rd-warmest-and-wettest-year-to-date
NOAA,Summer 2018 high tide outlook now available,https://www.noaa.gov/news/summer-2018-high-tide-outlook-now-available-ext
NOAA,NOAA discovery of green deep-sea sponge shows promise for cancer research,https://www.noaa.gov/news/noaa-discovery-of-green-deep-sea-sponge-shows-promise-for-cancer-research
NOAA,January 2024 marked 8th month in a row of record global warmth,https://www.noaa.gov/news/january-2024-marked-8th-month-in-row-of-record-global-warmth
NOAA,May continued the nation’s warm start to 2023,https://www.noaa.gov/news/may-continued-nations-warm-start-to-2023
NOAA,"Tornadoes, thunderstorms possible in central and eastern U.S.",https://www.noaa.gov/news/tornadoes-thunderstorms-possible-in-central-and-eastern-us-ext
NOAA,'Magnificent' new sponge from the deep gets a name,https://www.noaa.gov/news/magnificent-new-sponge-from-deep-gets-name-ext
NOAA,From vision to action: New NOAA strategic framework sets path for more resilient Arctic,https://www.noaa.gov/news/from-vision-to-action-new-noaa-strategic-framework-sets-path-for-more-resilient-arctic
NOAA,What's causing the Amazon’s ongoing record drought?,https://www.noaa.gov/news/whats-causing-amazons-ongoing-record-drought-ext
NOAA,Earth had its warmest November on record,https://www.noaa.gov/news/earth-had-its-warmest-november-on-record
NOAA,Warming influence of greenhouse gases continues to rise,https://www.noaa.gov/news/warming-influence-of-greenhouse-gases-continues-to-rise-ext
NOAA,Hello La Nina,https://www.noaa.gov/news/hello-la-nina
NOAA,"The ongoing marine heat waves in U.S. waters, explained",https://www.noaa.gov/news/ongoing-marine-heat-waves-in-us-waters-explained
NOAA,Will Nate affect your weather? Get information from NOAA’s National Weather Service,https://www.noaa.gov/news/will-nate-affect-your-weather-get-information-from-noaa-s-national-weather-service-ext
NOAA,An update on the ongoing coral disease outbreak in Florida,https://www.noaa.gov/news/update-on-ongoing-coral-disease-outbreak-in-florida-ext
NOAA,NOAA: 2017 was 3rd warmest year on record for the globe,https://www.noaa.gov/news/noaa-2017-was-3rd-warmest-year-on-record-for-globe
NOAA,NOAA scientist wins presidential award for innovative climate change study,https://www.noaa.gov/news/noaa-scientist-wins-presidential-award-for-innovative-climate-change-study-ext
NOAA,Landmark water agreement protects salmon and steelhead habitat—and landowners too,https://www.noaa.gov/news/landmark-water-agreement-protects-salmon-and-steelhead-habitat-and-landowners-too
NOAA,New NOAA grant opportunity will support K-12 environmental literacy for the Delaware Bay watershed,https://www.noaa.gov/office-education/bwet/news/new-noaa-grant-opportunity-will-support-k-12-environmental-literacy-for-delaware-bay-watershed
NOAA,Aerial images from #Debby damage assessment now available online,https://www.noaa.gov/news/aerial-images-from-debby-damage-assessment-now-available-online-ext
NOAA,Okeanos Explorer sets sail to the deep waters off the U.S. southeast coast,https://www.noaa.gov/news/okeanos-explorer-sets-sail-to-deep-waters-off-us-southeast-coast
NOAA,5 ways NOAA research is making your life better — right now,https://www.noaa.gov/news/5-ways-noaa-research-is-making-your-life-better-right-now
NOAA,September 2019 tied as 2nd hottest on record for U.S.,https://www.noaa.gov/news/september-2019-tied-as-2nd-hottest-on-record-for-us
NOAA,BIL-IRA Awards Explorer: Find investments making a big difference for U.S. communities,https://www.noaa.gov/news/bil-ira-awards-explorer-find-investments-making-big-difference-for-us-communities
